,comment,score,type
0,"The paper is a good read but the cryptocoinsnews article is terrible. Worst thing is the article's title. The paper does not recommend 4 MB blocksize, it says that blocksize should *not exceed* 4 MB.

Quote from the paper:
> Observation 1 (Throughput limit) Given the current overlay network and today’s 10 minute average block interval, the block size should not exceed 4MB.",92,0
1,Isn't this old news? Or have they released an updated version?,22,0
2,"Bitcoin CEO yesterday said, that he will consider this proposal.",3,0
3,"Interesting read (and I admittedly have to complete my reading of their actual report) but off of first impressions they haven't accounted for issues present with the great firewall of China. Considering a majority of hashrate sits behind this firewall, it compounds latency/propagation issues realized with larger blocks.",16,0
4,Andy Bernard would like to have a few words with you about using Cornell's name is vain.,2,0
5,Happy to see some brilliant minds showing we can and should do this now.,2,0
6,Ivory Tower exceptionalism does not matter. Fork it and compete or gtfo,4,0
7,"This is Aquent propaganda - taking a study, making his own interpretation, and going from there.",2,0
8,"""4,000 Bitcoin nodes were tested""

I'm not saying the conclusions are wrong, but focusing on preserving existing nodes (and/or miners) instead of attracting more new ones is the way towards centralization. 

It's the equivalent of import tariffs imposed on consumers to protect a privileged limited group of existing manufacturers at the cost of the economy. It doesn't allow for more competition, but leads to monopolization and cartelization instead. Anti-trust regulation always results in more monopolies.",2,0
9,They need to do a China-spefic study like this. This will be far more usefull.,1,0
10,"Well no, quite the opposite. The paper does not say that 4MB is safe, but it says that more is quite clearly unsafe. Which is why with segwit, the block size should be at maximum 1MB at present, because an adversary could create 4MB blocks in this environment.",-11,0
11,Does anyone have a spoon? I want to cut my veins,-2,0
12,But Gavin (anointed by Satoshi) said 20 MB is Okey Dokey.,-11,0
13,Cornell Study Recommends 4MB Blocksize for Bitcoin,399,2
0,"What is it and what does it do?     
Link details?",7,0
1,Where are these transactions stored?,4,0
2,"Bitcoin Core Project on Twitter: ""CHECKSEQUENCEVERIFY (CSV) soft fork has been merged! Preparing for relative lock-time transactions! https://t.co/7oNr30QT4P""",131,2
0,"Segnet4 was just created.  It combines CSV, versionbits, and Segwit.  Accordingly Lightning can be tested.  It is expected that this is the final stage Segwit.  Segwit is going to be implemented using versionbits. ",15,0
1,"Sipa has rebased the segwit branch to include bip9.  

https://github.com/sipa/bitcoin/tree/segwit4

I'm guessing the details are pretty much identical to CSV deployment except a different bit and date.  

The date depends on when it is merged AFAIK, so that will still be TBD",15,0
2,It depends on which version bits wannabe altcoins will choose for their hashpower majority activation.,-2,0
3,"Currently [BIP141 says](https://github.com/bitcoin/bips/blob/master/bip-0141.mediawiki#Deployment) 

>This BIP is to be deployed by version-bits BIP9. Exact details TDB.

From what I can see [the reference code](https://github.com/sipa/bitcoin/commit/1353f86b8bd19ee5a6cbaf7fd307e10819f598b0) still refers to BIP65 and not BIP9.

Is my understanding correct? I'm asking as there are posts which say segwit 'Enters Final Testnet Stage' and am not sure how this could be final without the activation details confirmed.",29,1
4,Segregated witness: When and how does it activate or when will this be decided?,29,2
0,I posted on this before.  This was for me the first time bitcoin served a really practical purpose.  It is sooooo much easier to get money on the site through bitcoin if you live in the US.  Other methods were expensive and difficult.,7,0
1,Not sure why they would recommend two wallets (coinbase/circle) that are notorious for suspending accounts that send bitcoins to gambling sites. ,5,0
2,But what about the withdraws? That's the most important part. ,6,0
3,Why would they only allow deposits and not withdrawals?  Are they hodling for speculation? I mean.. they are a gambling site.,4,0
4,A 50b billion $ industry which Poker Stars owns 70%+ of based on a monopoly held up by payment processing regulations.  Poker Stars won't stop raising the cost to play and the players are on the verge of snapping.  ,3,0
5,"When Bovada accepts BTC withdrawal this will be game changing.

Deposit only sucks.",3,0
6,"""Bovada now accepts the world’s most popular online currency, which is living up to the hype with all its benefits. A peer-to-peer digital cash system, Bitcoin provides security, accessibility and ease of use among other advantages.

With Bitcoin, you can seamlessly send money to friends or pay merchants. Anonymous accounts featuring immediately available deposits, with no fees, help round out the benefits of using Bitcoin with Bovada. There’s nothing to lose and everything to gain.

To make that deposit, get your “wallet,” or digital bank account today. We recommend Circle or Coinbase. For more info, check out our Bitcoin Help page.""",3,0
7,Let's talk when I can withdraw bitcoin. xD,2,0
8,How is this not a bigger deal?,1,0
9,"Let me get this straight before I go ahead and do it. I have set up a wallet with Blockchain. I've purchased bitcoin through Coin and sent them to my Blockchain and sent to Bovada to deposit and become eligible to withdraw using Bitcoin. 

When withdrawing, I should then withdraw to my Blockchain, and then send from Blockchain to Circle to be deposited to my bank?",1,0
10,"Just made my first deposit yesterday (and first ever bitcoin transaction) with coinbase and got the following email today:

""Our records indicate that your account may be involved in transaction(s) related to online gambling. Please be aware that pursuant to Appendix 1 of our User Agreement, Coinbase Services may not be used in connection with online gambling (https://www.coinbase.com/legal/user_agreement).

If you have sent funds to an online gambling site or have received funds from online gambling, please be aware that this is a violation of our Terms and we respectfully request you cease such activity.""

Assuming I should stop using coinbase and switch to something like mycelium? ",1,0
11,Hopefully they allow withdrawals in Bitcoin too.,1,0
12,"They operate from a sovereign Indian Reservation in the Mohawk Territory of Kahnawake in Quebec, Canada. If I lived up there, I'd keep my eyes out for drone strike. ",-4,0
0,"Kraft Mac & Cheese

Oreos

Not in any particular order",12,0
1,that would be so great for Bitcoin.  I hope it's true!,1,0
2,https://blog.wealthfront.com/introducing-new-dashboard/,1,0
3,A boy from Hawaii named Kananinoheaokuuhomeopuukaimanaalohilo has quite a big name. Maybe he's one of them.,1,0
4,"My Wishlist:

1. Netflix
2. AT&T/Tmobile/Verizon
3. Utility company
4. Tesla",1,0
5,Looks like coinbase and the rest of the Classic gang are prepping for a bitcoin coup.  I expect that includes a couple of exahash of power as well.  Massive cryptowar coming.  ,0,0
6,"If Amazon adopted Bitcoin in any way, which I think that they will be doing within the next 12-18 months I see BTC shooting to $800-$900",-3,0
7,"Adam White (VP of business development at Coinbase) says. “From the outside in, these large financial institutions have great insight into what Bitcoin and blockchain are doing, but are not so in the weeds that they’re tracking the block size debate and scaling issues.” Many of them continue to see potential in the technology and the currency. White says, “A couple big-name partnerships — without giving away too much — will signal that Bitcoin is really a legitimate, paradigm-shifting technology that’s not going to go away.”

Sauce: http://www.forbes.com/sites/laurashin/2016/03/29/uncertainty-in-bitcoin-doesnt-extend-to-startups/#40983fdc649f

What are these big name partnerships?",37,1
8,"“A couple big-name partnerships will signal that Bitcoin is really a legitimate, paradigm-shifting technology that’s not going to go away.”",37,2
0,"Bitcoin and Ethereum working together, hmmm

https://www.youtube.com/watch?v=euI3v2jpTlI",9,0
1,"1-4% for a user to spend, and merchants pay the same amount they currently pay to process card payments.  Would it pain someone to ask themselves the question ""Why would an average person choose to use this over they way they currently pay for things?""",6,0
2,Interesting. Is there a library I could use to support this in Bitcoin Knots?,4,0
3,Is this finally happening? Did anyone can confirm? ,1,0
4,Awesome! Can't wait to use this. So how do you know which terminals are NFC enabled? ,1,0
5,"Plutus Whitepaper is out - Use Bitcoin with any merchant with a Near Field Communication (NFC) enabled checkout terminal, regardless if the ""accept"" Bitcoin directly",56,2
0,"> Bitcoin Is Still The Digital Currency Of Choice ~~On The Dark Web~~

FTFY",4,0
1,"Bitcoin's always been the currency of choice in darknet markets. Chris says so :)
https://www.youtube.com/watch?v=Q-PLheQUzBI",1,0
2,Thats why press loves labeling bitcoin as money used to support buying drags and child porography. ,1,0
3,"Bitcoin is like a knife, you can use it to cook or you can use it slay people at melee, we all want everybody to use it for the right thing but we all know not everybody is going to do so.",0,0
4,"Yeah, except it clearly isn't.  With only 250,000 possible transactions a day and that number rarely ever being reached we can be really reasonably certain that bitcoin isn't even involved in even a tiny fraction of dark market anything. ",-2,0
5,Bitcoin Is Still The Digital Currency Of Choice On The Dark Web,11,2
0,Love this!  Here is the creator's donation address from the site:  1FSwKeATQN6Ja2kbWJf1B2XF7v4JPjKhMu,8,0
1,"Nice.

Would be cool with a vizualization of a chain and if one could view it in VR, hell even make transactions in VR. ",5,0
2,Awesome visualization. I can't wait for the visual block size to be debated.,4,0
3,The donation address should be a different color ball. This makes it fun to demonstrate to friends.,4,0
4,"Something very pleasing about the sounds and how it all just falls down together. You could probably make a side-game out of choosing which one will stay the longest on the platform, lol.",1,0
5,This is great! Well done! (I sat here watching it for a solid 5 minutes ... will be back again),1,0
6,Works in all 3 main browsers.,1,0
7,I've sent it to all my webdev friends because it's an amazing tech demo! Love it <3,1,0
8,Neat! Really cool demo. Thanks for sharing. :) Any chance the source will end up on Github or elsewhere eventually?,1,0
9,Bitbonkers a mesmerising webGL bitcoin transaction visualisation. Works best in Chrome.,47,2
0,"Hello,

The project isn't quite perfect yet. If you'd like to help, the [issues page](https://github.com/bitcoin-hivemind/hivemind/issues) is a good place to start. Or you can email me with your skills and interest.

Currently, we are working on a ""genesis set of blocks"", so that people have something to look at when they turn it on for the first time. This is on the testnet.

I haven't really promoted this project, for many many reasons. However, some of those reasons (for example ""project too unfinished"", ""regulatory uncertainty"", and ""take opportunity to pinpoint Fashionistas"") are now [coming to an end](http://www.cftc.gov/PressRoom/SpeechesTestimony/opagiancarlo-13) so you might be hearing more about it in the near future.",17,0
1,can this be used for making blockchain derivatives?,7,0
2,How is hivemind different from augur? ,4,0
3,I'm in.  Where do I go to predict that this will be be successful?,4,0
4,"'IndiaMikeZulu' is tiny, but we are plodding along, following the progress of this project.

Mark",1,0
5,Hivemind - Bitcoin Peer-to-Peer Oracle Protocol and Prediction Marketplace,81,2
0,2016: The year of the Bitcoin Excel. ,9,0
1,Just a symbol addition. You know what else Microsoft is up to in the cryptocurrency space? :D,8,0
2,The target solver will get sha256^(-1) support,3,0
3,"What so special about bitocin format, that its need dedicated support in office?",2,0
4,"Anyone else surprised by the amount of Bitcoin incorporation in so many different products, and the complete indifference of Joe Sixpack. I mean I'm pleased don't get me wrong, but like suprised.",1,0
5,People who use Excel probably dont even know what bitcoin is.,-4,0
6,MS Excel 2016 Will Have Native Support for Bitcoin Currency Format,184,2
0,"Look at that, someone dominating the BTC game in Brownsville. Strangely none at the airports, though.",2,0
1,"that's it, bitcoin is used by drug dealers and I""m a racist",1,0
2,Bitcoin ATMs Plotted Over NYC Census Data,24,2
0,"2015-04 - Rand Paul becomes the first US presidential candidate to accept Bitcoin  
2015-05 - Mycelium releases Mycelium Gear to make it easy for merchants to accept BTC  
2015-06 - Developers start using 21.co's initial devkit for their upcoming micropayments api  
2015-07 - Bitcoin Core 0.11 Released (pruned mode, fix memory issues, better fees, TOR)  
2015-08 - Coinbase announces availability in Canada  
2015-09 - Karpeles charged for embezzlement  
2015-10 - Bitcoin ruled tax free by Europe  
2015-11 - Bitcoin accepted by Unicode  
2015-12 - People in the US can start spending Bitcoin everywhere using the ""Shift"" VISA card    
2016-01 - Mike Hearn eliminated from Bitcoin  
2016-02 - Brave Web browser finishes last update before including Bitcoin payments  
2016-03 - Network withstands concerted spam attack - fees only rising a few cents to adapt  

Most recently have the release of Bitcoin Core 0.12 which includes 7x faster validation, pruned mode in the GUI wallet, minimal memory usage option, minimal bandwidth usage option, fix invalid fee relay and mining support, automatic TOR integration, ZMQ support and many other fixes. SegWit which will bring many other improvements has also been on a dedicated testnet for 3 months and CSV which is a requisite for the Lightning Network is also now on a dedicated testnet, preparing for release later this year.",21,0
1,https://github.com/bitcoin/bitcoin/tree/master/doc/release-notes,13,0
2,"Bitcoin died another 28 times and is still there.

(https://99bitcoins.com/bitcoinobituaries/)",5,0
3,https://www.reddit.com/r/Bitcoin/comments/3bx44a/what_have_the_core_bitcoin_devs_ever_done_for_us/,2,0
4,"For something so controversial, just continuing to exist is progress in itself.",7,0
5,"The commit page on the github might show you:

https://github.com/bitcoin/bitcoin/commits/master",2,0
6,"Volatility in Price has significantly reduced in recent month. I suspect a lot of the speculators are now moving their bets into altcoins, as the volatility seems to have come down as the market cap for altcoins has increased. Also, speculation is now not just in and out of Bitcoin/fiat. People are now staying in crypto-coins more when betting against bitcoin price.

This may not widely be seen as progress, but a drop in volatility does add a network effect as people can more easily price things in bitcoin. Not there yet, but on the way.",1,0
7,"Mizuho Bank and Fujitsu Trial Blockchain to Streamline Cross-Border Securities Transaction Settlements http://www.fujitsu.com/global/about/resources/news/press-releases/2016/0308-01.html

PS: Mizuho Financial group is on the R3 Bank consortium bank chain",1,0
8,"How is one supposed to respond to that question?  

That's like saying ""what progress has the internet made in past 12 months"".  Are you expecting a one sentence response from users or a book?  What do you define as ""progress"", since that's pretty subjective?  Increase in demand for space on the Bitcoin blockchain?  Increase in hash rate?  
https://blockchain.info/charts",1,0
9,"The progress is very good, so much that blocks need to increase in size...",-1,0
10,too much to remember it all. There are just too many different fronts of Bitcoin,1,0
11,Serious question. What progress has bitcoin made in the past 12 months?,6,2
0,"Modern paper wallets are the seeds of HD wallets. Both BIP39 and Electrum support encryption and decoy wallets.

Single-key paper wallets are a thing of the past. They promote address reuse, which is a security and privacy risk. You should use BIP38 only as a protection when, for some reason, you want to share a child key (ideally, a hardened one) of a HD wallet.",3,0
1,"The other post noting that paper wallets are in the past has good points.

IMHO though, they still offer advantages in terms of simplicity and security. ",2,0
2,How To Make A Secure BIP 38 Encrypted Bitcoin Paper Wallet – TUTORIAL,9,2
0,"It's fascinating to see this market develop, especially in such a highly regulated environment as the US. 

Hopefully this infrastructure gets put to good, scalable use shortly (ie. Remittance overseas).",1,0
1,"unfortunately not every one of these atm is active. I wish there was a better way than manually reporting them , but there isnt unless the companies want to release the stats themselves. That being said there still seems to be a growth of bitcoin atms which is good.",0,0
2,This map seems way off. Also is this all the ATM's in US?,0,0
3,Latest bitcoin ATM stats of the U.S. market,7,2
0,"err, it's actually an antidote...",5,0
1,a six billion dollar virus lol + open source,3,0
2,They're starting to get it!,2,0
3,"He is right. Bitcoin will spread across the world like a virus when it comes to mass adoption. If you call it Bitcoin virus or Bitcoin node, I want to have one installed on my computer and support p2p Bitcoin network.",2,0
4,"I understand Russia has needed to put a clamp down on Capital Flight, They need to end these sanctions or this anti bitcoin rhetoric will continue to flow from Russia. But its interesting to, The transfer of Rubels doesn't mean the disappear millions of dollars in transactions they just move to somebody else, The Bitcoin merchant has to accept them. No body is doing any Significant dealings with rubels... They need to understand that the do no harm approach would be a net boon to business, and a way around sanctions if the cards are played right. 



",1,0
5,a trojan horse in their crap economical system,1,0
6,Bitcoin calls Putin adviser a virus,1,0
7,Putin adviser calls bitcoin a virus,7,2
0,He used to be very sceptical about Bitcoin,6,0
1,"I think he understands how BTC can supplement gold in many ways, unlike Schiff. Though Schiff has come a long way from where he started",3,0
2,Then he must have a position to promote it,2,0
3,Time for some of the gold and silver stacker money to flow into bitcoin :-),2,0
4,Jim Rickards keeps mentioning bitcoin as money in every interview I hear lately,27,2
0,My Crypto cock is throbbing with anticipation - hope he discusses it publicly in Brazil,2,0
1,"Jon Fitch is sponsored by the HYPER Cryptocurrency team.
The HYPER thread is available here for anybody interested:
https://bitcointalk.org/index.php?topic=624651.6280


-------

Go Jon Fitch!",1,0
2,"Jon Fitch says he is “too good anywhere” for most welterweights in MMA. We tend to agree. This weekend he will collide with Joao “The Brazilian Samurai” Zeferino for the vacant World Series of Fighting welterweight (170 pounds) championship at stake. As we anticipate the weigh-ins tomorrow and the actual fight, we talk a bit about being the first MMA fighter to be fully paid in bitcoin. Fitch loves cryptocurrency and he thinks it is bringing about a new form of commerce. In addition we talk about Zuffa, the legalization of MMA in New York, Joe Rogan, bringing the Muhammad Ali Act into MMA, and more! Tony Swish and Cello are your guys on the 1’s & 2’s while the normal gang sit in for this special mid-week roundtable. Iiiiiiiiiiiiiiiiiit’s Tiiiiiiiiiiiiiime!!!

",0,0
3,"We interviewed the 1st crypto-company sponsored fighter,World Series of Fighting Welter Weight contender, Jon Fitch. He's also the first fighter to be fully paid in bitcoin.",29,2
0,so can I spend my bits on etsy over purse.io?,1,0
1,Purse Merchants now on Product Hunt: : Buy & Sell anything for Bitcoin,11,2
0,"Again, small moves keep coming from Japan.",2,0
1,Money Partners Group invests in the Kraken bitcoin exchange operator,13,2
0,"> Tuition: $69.00 Fees: $0.00 

If I wasn't on the other cost and I had the time I would go just to help keep it alive!

Edit: I also hope that Jack D Andrews, the instructor, knows the subject well enough.",1,0
1,"Remember Ethereum is the new main cryptocurrency, we even got a plugin for Visual Studio and pretended microsoft helped and that it was a massive partnership ignoring anyone with a MSDN account can submit a plugin.",-1,0
2,"Bitcoin has come a long way, but it is no way guaranteed to succeed or even survive. Things like this make it seem more real to people and help change the perception of illicit drug money.


Please share knowledge of this course to anyone you know in the Portland, OR area, it still needs a few people to sign up.

[Link](https://www.pcc.edu/schedule/default.cfm?fa=dspCourse2&thisTerm=201602&crsCode=9MNY610E&subjCode=9MNY&crsNum=610E&topicCode=FIN&subtopicCode=) to the course page.",36,1
3,"Portland, Oregon Community College is offering a course on Bitcoin, blockchain, and cryptocurrency. Yay legitimacy!",36,2
0,"I thought that was an excellent interview. Trace Mayer brings up some interesting facts. 

I was about to subscribe to the idea that Bitcoin supply is inelastic and that could influence the price positively even if it is currently inflating at a constant rate. But the supply that actually matters, is the supply on the exchanges. And this is an elastic supply. For example, there is an abundance of Bitcoin on the exchanges at the moment, because ETH has been doing so well, and people have been making loads of BTC. So there is an oversupply of BTC because everyone is making money on ETH it seems. This causes downward pressure on BTC-Fiat price, because fiat is still the go-to currency if you want to consume. And the people who took profit, are expected to cash some of it out. Which is why BTC->Fiat is likely going down. However, in the beginning when ETH peaked, it was some serious drops. People didnt care, they just wanted some cash, right now. But right now, it seems they are timing it. Everytime there is a top, there is a sell.  The next phase will be, that every time there is a top, there is going to hodling instead, because most of the excess BTC will have changed hands into the hodlers.",2,0
1,"War on Cash, Negative Interest Rates...Bitcoin Can Protect You - Trace Mayer Interview",15,2
0,The article doesn't actually address the premise at all it just kind of hand waves over all of the technical points.,1,0
1,"It is not so much cars vs internal combustion engine debate, but cars and internal engine conversation???",0,0
2,"It is not so much a “Bitcoin vs. Blockchain” debate, as much as it is a “Bitcoin and Blockchain” conversation",11,2
0,"Was this originally written in Russian, thus a poor translation, or have I just not had enough coffee yet?",1,0
1,"Bitcoin, Cashless Economy and NIRP, Part I",7,2
0,Jim Rickards and the new case for gold (Bitcoin mentioned),15,2
0,Bitcoin Fullnode Update Dispatch Commences - Wednesday 30th March 2016,5,2
0,How Bitcoin Comes to Rescue of Oppressed Afghani Women,15,2
0,Coinbase Aims to Drive Bitcoin Adoption via New Killer Apps,7,2
0,"There is no incentive for a consumer to use Bitcoin at present unless they bought for far less. 

If I'm buying a dildo online I don't give a fuck about what the credit card fees the merchant's paying are, I don't care about my fiat being debased or how evil the banks are. 

I want my dildo inserted up me 24/48 hours after deciding I want it there.  ",19,0
1,"Accepting credit cards is costly for merchants.  These costs do get passed on to consumers but the consumers don't notice them because they are priced in.

Unfortunately merchants in America have a habit of passing on the costs to *all* consumers, even the ones who don't pay by credit card.

Effectively, the consumers who pay by cash or bitcoin are subsidizing the consumers who pay by credit card. That is not the fault of bitcoin, because it's 100% up to the merchants which payment system they subsidize or penalize.

Outside America the situation is different. In Germany, for instance, merchants hate using credit cards. You often have to pay a 2-3% ""credit card fee"" and many smaller merchants don't accept them at all. 

",29,0
2,"Bitcoin has value mainly due to regulatory arbitrage. If you are not under-served in your market (eg: you have access to a low interest credit card) then you have no reason to spend bitcoin. There can still be value in HODLing Bitcoin, however, as it does serve the under-served in certain situations. If something has value to someone, even if that someone is not you, then that something HAS value to you. Listen to some Bitcoin Uncensored podcast episodes, and everything will be made much clearer.",23,0
3,"Bitcoin's killer app is censorship resistance. For many including myself, that alone is worth more than 4% though often it's much less or even negative.",14,0
