,comment,score,type
3,"Stealing is serious criminal behavior. So I advocate that individuals should do everything they can to protect what they have earned. 

For example, let's say some large gang were able to take over a large geographic area containing where your gran happens to reside. 

Well, the gang might think, when that lady dies we'll shake down all of her relatives as they come to mourn her passing. This way, the other wealthy people in their territory won't be as worried.

Well, if gran decided to buy bitcoin off-exchange through Local Bitcoin or even through an exchange but somehow the coins were not recoverable upon her death... well there's nothing anyone could ever do about that.

See gran will need to make a backup of her keys, and its entirely reasonable for her to ask her tech savvy grand kids to help her. It would be their responsibility to make sure proper backups are made - but hey mistakes are made all of the time. But if those kids were lying the gang would consider it a serious insult and they're likely to send thugs armed with guns to punish the grand kids. 

The gang may ask to know things - like the address of the coins. Which they could get if they were able to coerce the exchange where gran bought her coins - but localbitcoins this is not necessarily true. It's also possible that gran is a secretly a techno-savvy cypher punk and as soon as her grand kids aren't looking she launders her coins through Monero and then back to other bitcoin. Then gran tells her kids she lost them trying to get involved with OneCoin. ",3,0
4,"A lock and slow-release mechanism outside the protocol? For example, 3 lawyers in 3 different countries (not including her country of residence) who are authorized to release one three-of-three multisig key each per year to the heirs? It would move the jurisdiction on those coins outside the country and provably outside the control of the heirs.",2,0
5,"Speak to a tax lawyer and investment advisor now.  There's lots of ways without bitcoin to shield those she wants to give money to from having to pay taxes, but jurisdiction matters a lot.  She can give gifts up to certain amounts now and jointly hold other assets now so that their ownership is not transferred through her will.  

If she wants to secretly purchase bitcoin and secretly give the keys to someone else, that's in a gray area of course, but that is very likely to be hard to be found out about.  But she could just as easily give cash directly to people she wants to.",2,0
6,"She's got two months to live?

Spend as much time with her as you can. Once she's gone, you'll be wishing you could see her again and regret not spending more time with her.

DO NOT mention inheritance. DO NOT try to get her to change her affairs of buy Bitcoin so you can dodge tax. Only vultures do that. If she thinks you are a vulture after the money, she might shut you out of the will anyway, but the last thing you want is your great grandmother hating you as she dies. There's no way to come back from that, it's too late to say sorry and you'll feel bad the rest of your life.",2,0
7,"> Hypothetically 

it would be conspiracy to defraud the state?",2,0
8,Why should you help pay back the society that made her rich. You deserve that money way more then anyone else. Poor people should just get rich Grandma's? Your not a cum guzzling cunt at all.,2,0
9,convert to bitcoin in grannys name. then from bitcoin to byte coin in grannys name. create a bytecoin wallet on your own node and transfer funds to bytecoin wallet address. transfer from bytecoin wallet on your node to exchange bytecoin wallet. ,1,0
10,how can she? shouldnt it be how can you [or the inheritors?] :),1,0
11,If you where to do this.. i'm not saying you should... i would have a look at the most untracable coin atm and use that instead od bitcoins.. ,1,0
12,"Ask grand ma buy BTC...

Move out from the socialist tax hell as we know as the West !

Move onto Dubai, HK, or island...

I guess if you are US person renounce citizenship...

Be free and live.",1,0
13,buy it with all her wealth and gift it to you.,1,0
14,My plan would be don't buy cryptos with all the money so it wont be too suspicious. Bitcoin is not anonymous enough IMO. There is too high risk of getting caught (not likely but still). You should buy more anonymous altcoin like zcash or monero. Then incase you want to swap to bitcoin create new exchange account (using vpn) to exchange that doesn't require ID and fill forms with fake info. After that if you want to cash out large amount of cryptos without getting caught and without having to pay income tax do it via cash trades.,1,0
15,Fun fact: Cryptocurrencies are in fact NOT anonymous.,1,0
16,"You could instruct her how to acquire bitcoin to go all in, set her up with a wallet where she owns her private keys. Maybe Bitcoin Core. 

But she is old and would probably lose her private keys or throw her computer away without realizing what she is doing. That would be a real shame, it happens a lot though...

",1,0
17,My great grandmother is very wealthy and has 2 months to live. How can she use Bitcoin to avoid Inheritence tax?,28,2
0,"People are messaging me saying I am trying to scam people here. Ummm...I am super curious where I have asked for money?

Also, can't you just post here in this thread? Most people who message me just threaten me. So I rarely read those messages.

I get it.  I am unlikeable. I mean...who wouldn't hate someone who tries to share what they are working on with a group of people who claim to be interested in stuff like this? People who share are the worst, aren't they? 

I am not telling people to invest $15 million in a bitcoin mining operation/solar farm/vertical farm. I am doing that myself. Nowhere in my posts have I ever asked people to give me money.

Is there ANY chance that everyone here is stupid?  I know that comes off as mean. But let's think about it. Pretty much everyone here is mostly just hoping to get rich quick. They claim to be interested in changing the world and all that though a decentralized currency. But they just wanna get rich without working hard.

If you guys were that smart then you would have understood bitcoin a long time ago. You would have gone in very big. But you didn't. I did. And I am still doing that. I am guessing that is annoying for the majority of people here.

For those of you who are actually interested, my numbers are for real. They are based on my books for the business I started with the money I swiped form a handful of idiots here.",55,0
1,"Ok, I am getting some people messaging me to call me out. It would be easier if you just post in this thread. I rarely respond to people in private messages.

If you really are interested in starting another bet, then everyone here must know by now that I am always open for that, I just ask that we make it public. 

So, it seems that this post is just going to irritate people again. I am guessing that miners are irritated that I decided to publish how someone could actually mine for a profit.

Two people have messaged me asking me to not discuss reselling  miners. Apparently I am not the inventor of that idea. It looks like miners do not want smaller guys mining and then placing their slightly used machines for sale to profit. I am guessing that the miners will now try to drive this post into obscurity.

Bummer. I feel that the info I am publishing here is useful and has value. Oh well, no one was ever gonna do it. I literally shared my entire basic business plan with costs and revenues. Because no one here has the money or resources to even copy it. Helll, no one here has enough resources to even try it in their garage. So...you miners should not be nervous. Your precious resell market is still protected. These people are poor. Stop worrying that I am gonna give away your secrets.",21,0
2,"Honestly a lot of people don't believe you, but you're also a bit of a cock and that's not adding to your credibility. It'd be extremely simple to post quality proof but you dance around offering bets like some 6 yo trying to trick their classmates out of lunch money.",3,0
3,">Next, these greenhouses grow about 4,000 heads of lettuce per month.

If you're selling 4000 head of lettuce per month, you're either registered as a company or up for serious tax evasion.  Not really interested in seeing your fake photoshopped pictures or videos of somebody else's land or whatever, but if you can give the name of your company here, that'd really help prove you are doing what you claim.  cheers. good luck. ",3,0
4,"Hey Dan, I'm very interested in how you run your business. I've read your posts and I think what you're doing is awesome. I would like to know what pool you use and how you network your miners. Also who your suppliers are. I am buying an l3+ this weekend and hope to scale as soon as possible. Nicehash has a stratum pool they use and I am probably going to use them. I am extremely interested in learning about how you cool your greenhouses and how you plan on setting them up once you get the big stock of miners come September. Thank you. ",3,0
5,"Hmm, where shall we put our device that needs massive cooling. I suppose the desert?",6,0
6,"Hey, ""We spend about $0.45 per watt for solar panels from China"" Thats pretty cheap! Which dealer did you get them from? Also, nice read. ",2,0
7,That's interesting. I am in Dubai and was contemplating some similar experiments. My concern is the cooling costs.,2,0
8,I love it. I fucking love it. :),2,0
9,"you own people 4.000 BTC?
huh?

explain that part please",2,0
10,"This sub is so strange.  And awesome, I do have to admit that as well.

How can people read my posts and then constantly claim that I am trying to steal their money or rip them off?

I mean...I get it that mostly millenials use Reddit. But are they truly that stupid? Yes...I know they are. But THAT stupid?  It just can't be. No one is that stupid. Right...?

I know this sounds crazy and it probably is...but is there ANY chance that miners are controlling this sub? Is there ANY chance that they are trying to get the word out, through any means they have, that people shouldn't mine? I know that sounds crazy and maybe it is crazy. But I think back to all the times I have posted here about mining and I am blasted by peple who just make stuff up about how mining is a losing business.

If it TRULY is a losing business then how come there are so many miners that are running right now? AND how is the network still growing so quickly if EVERYONE is losing money? I feel that this sub is not clean.",2,0
11,Uh.  Where's the water source for the high-water-requirements lettuce coming from again?,1,0
12,"I would never get into mining myself until their lifespan increases, but cool that you are able to do it.

Are you involved in any bets at the moment? How much is at stake if that is the case?",1,0
13,Nice. Can you post some photos and mining stats?,1,0
14,"given the fact the selling energy back to the grid is more efficient than storing the energy into battery (in chemical form, and use it later back in electricity form), why don't you totally use a grid-tied solution with some net-metering ?",1,0
15,Can we see pictures of this setup? ,1,0
16,"Can you post some pictures, obviously dont have to reveal everything, but I really wanna see what this looks like",1,0
17,"Hey Dan, 

I know I'm a little late to the party on this one but just wanted to say thanks for sharing your setup, a lot of us really do appreciate seeing how other people make money. Just had one somewhat silly question if you have time: is there a reason why you need a greenhouse to grow crops in San Diego? Isn't the climate already pretty well setup to handle farming outdoors? Just curious what it is about a greenhouse that makes this possible. I was under the impression they were mainly needed in colder climates. Thanks! ",1,0
18,"Hey Dan, 

I know I'm a little late to the party on this one but just wanted to say thanks for sharing your setup, a lot of us really do appreciate seeing how other people make money. Just had one somewhat silly question if you have time: is there a reason why you need a greenhouse to grow crops in San Diego? Isn't the climate already pretty well setup to handle farming outdoors? Just curious what it is about a greenhouse that makes this possible. I was under the impression they were mainly needed in colder climates. Thanks! ",1,0
19,I always follow your stories. Great job! You are one of my inspiration. I'll surely follow your tracks and wait for my Paxful wallet to harvest more.,1,0
20,"bitmain used miner salesman  hahaha---but ur a funny guy,an you got alot of typing energy too ---doobies on the side?",1,0
21,"Tl;Dr - Just skip to the bottom where I lay out my solar/battery requirements for mining and my solar/battery requirements for vertical farming. Oh...and costs and earnings.

Well, Summer is here and we have had some extremely hot weeks. This has given us a chance to test our greenhouses at temperatures of 126F/52C. We are still up and running quite well. Our energy requirements have gone up quite a bit. But the electricity we are consuming is right in line with our estimates. We do not feel that the temperatures will be any higher than the numbers we have seen so far. Unless Global Warming is for real...because now that I think about it, we did blow through our all-time-high in temperatures...and this was the last day of Spring, if I recall.

We are ordering all of our equipment directly from China. Our 40' greenhouses are extremely cheap to build in China. We are building them for about 40% of what companies like Freight Farms and Bright-Agro-Tech are selling their systems for. Our system is at least 90% as good as their systems. But we do have many bugs, it seems when we first receive them from China. Perhaps my main complaint. They can be a bit finicky. I would not want to sell these as the customer service would consume me.

Our most simple greenhouse uses between 250 and 450 kwh per day. I am in San Diego. Our residential rates from SDG&E are $0.43 per kwh. That is crazy high, for the record. This would cost between about $105 and $190 per DAY. Between about $3,000 and $5,500 per month. Most people in the US pay about $0.11 per kwh. This would equate to a monthly bill of $750 and $1350 per month. The Arizona desert pays that rate, for example.

Next, these greenhouses grow about 4,000 heads of lettuce per month. Wholesale price for this lettuce is $1. We sell direct to the end user. We charge $1.50. But at wholesale prices, this generates $4,000 per month in revenue. Labor is 10 hours per greenhouse. We pay $20 per hour. When you add all the California bullshit taxes and fees for employees this puts us at about $30 per hour. We also have insurance and Workers Comp. This is about $40 per month for each greenhouse.

Ok, now for the solar and battery requirements. We use 150 panels of 300 watt panels. I know...this is a lot. It takes a lot of space. You need a lot of cheap land. We spend about $0.45 per watt for solar panels from China. Our lettuce greenhouses run for 8 hours per day with lights. The other 16 hours we go ""dark"" and do not use much energy (just pumps, air conditioning and a few devices). We run the lights and everything during the peak sun hours. This allows us to not purchase as many batteries because we are turning the sun directly into the farming and lighting. Then, when the sun starts to wane, we turn most systems off and just remain in a well-insulated state. The battery requirements are still large, however. We currently use 50 lead acid batteries for each greenhouse. Each battery is 24V and 200 amp hours. Each battery costs us $180 from China.

Ok, how does this all tie into bitcoin and bitcoin mining? Here's the answer. Each Antminer S9 uses about 1400 watts when it is placed in the environment of our lettuce greenhouse. We place between one and four miners in each greenhouse. We need about 6,000 watts in solar panels to charge up the batteries and simultaneously run one S9 for 24 hours straight. We need 15 of the 24V/200 amp hour batteries for each miner. Cost for panels is $3,000. Batteries are $2750. The miner, when you buy from Bitmain is $1225 delivered to your door in the US. I have over-clocked the miners as high as I am comfy with. I am generating 0.007 btc per miner per day right now. That is about $18 per day at today's rate.

So here is how it all breaks down for the vertical farm: cost for one lettuce farm that is 100% off grid is about $90k. This includes EVERYTHING... solar, batteries, control systems, installation and framing for the solar, greenhouse, all equipment, air conditioners a water cooler...everything. Monthly labor, insurance, nutrients and supplies is $1500. Shipping of the lettuce is about $400. Total net profit is about $2100 per month. And $25,000 per year.

Mining...ok...this is the wobbly one to predict. Just remember this and it'll make it all easier to accept these numbers: bitcoin is probably headed to $10,000 within 3 years. If you don't believe that then much of this will just be comical to you (if it isn't already). One miner will cost (miner + solar panels + batteries + power control systems + cooling equipment and the solar/batteries to support it) = $8000. The solar and battery system costs a total of $6800. The miner is $1200. Once you have purchased the solar and batteries, you own them forever. They can be used to mine for 25 years for solar and at least 6 years with the lead acid batteries. You can amortize these costs.  If bitcoin drops to $0 then you can instantly switch your solar and batteries to your farm. This is how I backstop my potential losses. 

Now, here is the magical way we have figured out how to avoid the ""decay"" that is built into the miners: we run them for 4 to 8 weeks then we sell them on the open market at a premium over cost. When you purchase large numbers from Bitmain, they will offer you a discounted price. The miners seem to always go up in value in between releases fom Bitmain. After 6 to 9 months of reselling at this pace, you will make all of your initial investment back in the miners. You will also stay current with the miners. So, one miner will generate about 2 btc per year (when you stay ahead of decay). That is $5,000 per year at today's rate. If bitcoin follows the trend (and you believe) then I expect that you will generate $6500 or more within one year from mining today. This means the system will completely pay for itself (including solar and batteries) in about one year. Oh...and then after a year, you own a brand new miner (cuz you have been constantly reselling them to stay current and slightly profit). Oh...and you how have 6kw of solar AND batteries...just keep mining til bitcoin is outlawed. You are now in a unique position...your mining rig costs you $0 from this point forward.

I have calculated the amount of profit you can make if you build your own solar/battery array and point this array to different businesses. One business is a modern, vertical farm which is good for the environment and makes healthier food. The other is a bitcoin mining operation. Both businesses have energy as their single largest cost of doing business. I like the idea of having two businesses that I can just point an energy source towards and they start making money. Isn't that kinda cool to think about? Farming generates a net profit of $0.22 per kwh from a solar/battery system. Bitcoin mining generates $0.51 per kwh for the exact same system. Think about that for a minute.

Also, what the fuck? If bitcoin actually does take off, imagine how it will pollute the world with miners in places with shitty but cheap fossil fuel. Shouldn't we be mining on renewable energy since...let's be honest, bitcoin shouldn't really exist? It only exists because people lie a bunch. It seems like protecting ourselves from our despicable selves shouldn't turn the world into a toilet that may become uninhabitable.

I just wanted to share everything with this community. If it weren't for this community, I would have been nervous about trying this crazy idea. What I mean by this is that I appreciate the handful of people here who have a lot of bitcoin and just handed them over to me so that I could test this TOTALLY insane and HIGHLY SPECULATIVE business model. I told you (those who lost their btc to me) that I will make it up to you. For the couple of you who didn't threaten to kill me, I will return your btc when my profits from mining hit 4,000 btc, unless the price is under $3100 per btc...seems fair...you did lose...and it was a fair bet.

I hope for several things from this post. (1) The nice people who are here hopefully will take this info and appreciate what went into getting these numbers. (2) Someone will read this, run the numbers themselves and decide to do the exact same thing. (3) Someone in an area with good sun, year round, will set up a mining operation based on my model. (4) Someone will bet me publicly again that I am lying. (5) Someone interesting will buy the land next to mine and compete head-to-head with me...I seem to perform better under competition.

To;Dr - To take a miner off grid, in a sunny place, will cost $8,000 (including the miner). You'll break even in a year if you follow my plan (and if fate complies as well). One 40' greenhouse that is off grid costs me $90k. Least amount of net profit per greenhouse is $25,000 per year. Average net profit is $36,000per year, typically from blending lettuce and other crops such as basil.

Farming generates a net profit of $0.22 per kwh from a solar/battery system. Bitcoin mining generates $0.51 per kwh for the exact same system. Think about that for a minute. We sell energy back to the grid for about $0.05. Does anyone look at this the way I am looking at it?...I am just curious.

Anybody have any questions?",162,1
22,Another update on my solar powered farm and bitcoin mining in the desert,162,2
0,">Continuing on about scaling, Wright said the network needs big nodes regardless of the cost. He couldn’t give a “rat’s ass” about individuals running nodes on Raspberry Pi machines, he said, and told anyone that can’t afford a large node to “fuck off.”

**Totally** sounds like Satoshi. I mean HAS ANYONE READ THE WHITEPAPER?!?!?",91,0
1,"""If you don't like it, go to an altcoin and compete with me""

You are not the leader of Bitcoin, a DECENTRALIZED currency. I don't have to move to an altcoin, but maybe you should because you seem to want control and ownership of Bitcoin. Well, it's not up for grabs.

You notice that his way of talking is self centered and confident that he can own and control the direction of Bitcoin. Then I look at Andreas Antonopolous and realize that he doesn't say the direction he wants Bitcoin to go, he simply reacts to what he sees others do. He describes how the ecosystem works, as opposed to how his own opinion of Bitcoin should work.

I wonder who is going to go down in history as the leader of Bitcoin... The one who wants to be a king, or the one who wants to see where the people bring themselves...",32,0
2,"> Wright then went on to threaten those who doubt his legitimacy, saying he would pursue legal action against anyone calling him a fraud.

YOU ARE THE EPITOME OF FRAUD",28,0
3,"This is fucking ridiculous, can he just go away already?",31,0
4,"I am just going to post this: I read code written by Craig Wright. 

He cannot even make a simple bash script. 

If he really is satoshi, he is really good at convincing the world that he is not.",15,0
5,">Continuing on about scaling, Wright said the network needs big nodes regardless of the cost. He couldn’t give a “rat’s ass” about individuals running nodes on Raspberry Pi machines, he said, and told anyone that can’t afford a large node to “fuck off.”

science xD",11,0
6,"You can't just sit back and watch, or what you take for granted will be taken away by unethical people who want to murder decentralized Bitcoin

Appeasement does not work, only standing up for what is right and standing up for your own freedom when threatened works ",23,0
7,"Got to love Roger Ver's comment on the article:

>This is one of the most biased articles ever.

And that's all he wrote. No rebuttal or evidence to the contrary, just that. ",7,0
8,Is /btc buying this? I can't tell what they believe anymore,4,0
9,"> yielded his speaking time to the Australian computer scientist.

""Computer scientist"" is a very strong word for what's being described here. He's certainly Australian though.",4,0
10,What this guy needs is a good punch in the face. ,4,0
11,Taking advantage of [wizard's first rule](http://www.sword-of-truth.com/wizards-rules),3,0
12,who is this guy? why do we even lose time looking at his face?,3,0
13,what a fucken moron... I can't believe people are listening to this guy.,3,0
14,Satoshi vs Craig is like Humility vs Loud Mouth,3,0
15,"Could someone make a simple list of what users should do to fight against these yahoos?  I've been involved with crypto for 5 years, but still can't figure out how to ""place my vote"".  I can't figure out if I should be running Core or Classic or what I should do to voice my opinion.  A simple list of 5 steps for people to do might get people moving.  I can't be the only one confused by this political mess. ",4,0
16,"The most interesting thing about Craig is that Satoshi still hasn't appeared on the P2P Foundation website saying ""I am not Craig Wright""",4,0
17,We're all being hurt by this scammer in real financial terms.  Maybe we should start a class-action lawsuit against Craig Wright.  There's certainly more than enough evidence for a civil lawsuit.,2,0
